<?xml version="1.0" encoding="UTF-8"?>
<!DOCTYPE category SYSTEM "category.dtd">
<category edit="all" name="Presse">
	<description>Exemples</description>
	<sourceProfiles>
		<sourceProfile id="un" access="public"
			name="Outils pÃ©dagogique de Rennes 1" specificUserContent="no"
			url="${config.url.prefix}/flux.offline.xml">
			<visibility>
				<allowed></allowed>
				<autoSubscribed></autoSubscribed>
				<obliged>
					<group name="local.0" />  <!-- Tous les groupes de personnes -->
					<group name="local.15" /> <!-- Anonymes -->
				</obliged>
			</visibility>
		</sourceProfile>

		<!-- <sourceProfile id="deux" access="public" name="LeMonde.fr : International" 
			specificUserContent="no" ttl="86400" url="http://www.lemonde.fr/rss/sequence/0,2-3210,1-0,0.xml"> 
			<visibility> <obliged> <group name="local.0" /> <group name="local.15" /> 
			</obliged> </visibility> </sourceProfile> <sourceProfile id="trois" access="public" 
			name="L'Equipe.fr : Actu Sport" specificUserContent="no" ttl="86400" url="http://www.lequipe.fr/Xml/actu_rss.xml"> 
			<visibility> <obliged> <group name="local.0" /> <group name="local.15" /> 
			</obliged> </visibility> </sourceProfile> -->

	</sourceProfiles>
	<visibility>
		<allowed></allowed>
		<autoSubscribed></autoSubscribed>
		<obliged>
			<group name="local.0" />
			<group name="local.15" />
		</obliged>
	</visibility>
</category>
