<?xml version="1.0" encoding="ISO-8859-1"?>
<!DOCTYPE category SYSTEM "category.dtd">
<category edit="all" name="Presse" ttl="">
	<description>Actualités Bretagne</description>
	<sourceProfiles>
		<sourceProfile id="un" access="public" name="Bretagne" 
		 specificUserContent="no" ttl="86400" url="http://www.lemonde.fr/rss/une.xml">
			<visibility>
				<obliged>
					<group name="local.0"/>  <!-- Tous les groupes de personnes -->
				</obliged>
			</visibility>		
		</sourceProfile>
		
		<sourceProfile id="deux" access="public" name="LeMonde.fr : International" 
		 specificUserContent="no" ttl="86400" url="http://www.lemonde.fr/rss/sequence/0,2-3210,1-0,0.xml">
			<visibility>
				<obliged>
					<group name="local.0"/>  <!-- Tous les groupes de personnes -->
				</obliged>
			</visibility>		
		</sourceProfile>
		
		<sourceProfile id="trois" access="public" name="L'Equipe.fr : Actu Sport" 
		 specificUserContent="no" ttl="86400" url="http://www.lequipe.fr/Xml/actu_rss.xml">
			<visibility>
				<obliged>
					<group name="local.0"/>  <!-- Tous les groupes de personnes -->
				</obliged>
			</visibility>		
		</sourceProfile>
		
	</sourceProfiles>
	<visibility>
		<obliged>
			<group name="local.0"/>
		</obliged>
	</visibility>
</category>
