<?xml version="1.0" encoding="ISO-8859-1"?>
<!DOCTYPE category SYSTEM "category.dtd">
<category edit="all" name="Infos Bretagne" ttl="3600">
	<description>Infos Bretagne</description>
	<sourceProfiles>
		<sourceProfile id="insa1" access="public"
			name="Actus Bretagne" specificUserContent="no" ttl="86400"
			url="http://www.bretagne.fr/internet/feed/Rss2.jsp?id=JB080118_6262&#38;pcat=j_6">
			<visibility>
				<obliged>
				<group name="local.0"/>  <!-- Tous les groupes de personnes -->				
				</obliged>
			</visibility>
		</sourceProfile>
		<sourceProfile id="insa2" access="public"
			name="Actus Departement" specificUserContent="no" ttl="86400"
			url="http://www.ille-et-vilaine.fr/index.php?cmpref=735&#38;parentref=90429&#38;module=news&#38;action=ViewFeed">
			<visibility>
				<obliged>
				<group name="local.0"/>  <!-- Tous les groupes de personnes -->
				</obliged>
			</visibility>
		</sourceProfile>
		<sourceProfile id="insa3" access="public"
			name="Actus (Rennes Metropole) specificUserContent="no" ttl="86400"
			url="http://www.rennes-metropole.fr/?syndicationParam[idFeed]=149599&#38;syndicationParam[type]=rss&#38;module=syndication&#38;action=GetSyndication">
			<visibility>
				<obliged>
				<group name="local.0"/>  <!-- Tous les groupes de personnes -->
				</obliged>
			</visibility>
		</sourceProfile>
		<sourceProfile id="insa4" access="public"
                        name="Actus Recherche (Rennes Metropole)" specificUserContent="no" ttl="86400"
                        url="http://www.rennes-metropole.fr/?syndicationParam[idFeed]=149610&#38;syndicationParam[type]=rss&#38;module=syndication&#38;action=GetSyndication">
                        <visibility>
                                <obliged>
                                <group name="local.0"/>  <!-- Tous les groupes de personnes -->
                                </obliged>
                        </visibility>
                </sourceProfile>
	</sourceProfiles>
</category>
